{
  "usage_id": "usg_synthetic_0001",
  "occurred_at": "2026-08-31T10:00:00Z",
  "dimension": "ai_tokens",
  "quantity": {
    "amount": "1450",
    "unit": "token"
  },
  "attribution": {
    "workspace_id": "00000000-0000-4000-8000-000000000001",
    "job_id": "job_synthetic_0001",
    "provider_key": "ai.primary"
  },
  "cost": {
    "amount": "0.0425",
    "currency": "THB",
    "basis": "provider_reported",
    "supersedes_usage_id": "usg_synthetic_0003"
  },
  "dedupe_key": "usg:00000000-0000-4000-8000-000000000001:job_synthetic_0001:ai_tokens:provider_reported:20260831T100000Z",
  "tenant_context": {
    "workspace_id": "00000000-0000-4000-8000-000000000001",
    "business_profile_id": "00000000-0000-4000-8000-000000000002",
    "page_context_profile_id": "00000000-0000-4000-8000-000000000003",
    "actor": {
      "kind": "user",
      "id": "00000000-0000-4000-8000-000000000004"
    },
    "request_id": "00000000-0000-4000-8000-000000000005",
    "correlation_id": "00000000-0000-4000-8000-000000000006",
    "locale": "th-TH",
    "timezone": "Asia/Bangkok"
  }
}
